[
  {
    "utility_id": "ut_anomaly_01",
    "utility_name": "Anomaly Test Electric",
    "country_code": "US",
    "region": "Texas",
    "residential_rate_cents_kwh": 9999.0,
    "effective_date": "2026-08-22",
    "source_url": "https://example.com/anomaly",
    "retrieved_at": "2026-08-22T00:00:00.000Z"
  }
]
